ID;Active (0/1);Name *;Categories (x,y,z...);Price tax excluded or Price tax included;Tax rules ID;Wholesale price;On sale (0/1);Discount amount;Discount percent;Discount from (yyyy-mm-dd);Discount to (yyyy-mm-dd);Reference #;Supplier reference #;Supplier;Manufacturer;EAN13;UPC;Ecotax;Width;Height;Depth;Weight;Quantity;Minimal quantity;Visibility;Additional shipping cost;Unity;Unit price ratio;Short description;Description;Tags (x,y,z...);Meta title;Meta keywords;Meta description;URL rewritten;Text when in stock;Text when backorder allowed;Available for order (0 = No, 1 = Yes);Product available date;Product creation date;Show price (0 = No, 1 = Yes);Image URLs (x,y,z...);Delete existing images (0 = No, 1 = Yes);Feature(Name:Value:Position);Available online only (0 = No, 1 = Yes);Condition;Customizable (0 = No, 1 = Yes);Uploadable files (0 = No, 1 = Yes);Text fields (0 = No, 1 = Yes);Out of stock;ID / Name of shop;Advanced stock management;Depends On Stock;Warehouse
SER0001;1;"Bonito del Norte en aceite de Oliva. Lata ""TIPICA"" redonda roja de 120g.";012005;1,755;2;;;;;;;;0016;Conservas Serrats;Conservas Serrats;;;;;;;120g;1;;both;;UN;;"Lomos de Bonito del Norte, cuidadosamente seleccionados por Conservas Serrats, cubiertos con aceite de oliva y presentados en envase met·lico y con el tamaÒo de lata m·s ""tÌpico""";"TambiÈn denominado At˙n Blanco. Es el pescado de mayor calidad de la familia de los atunes y, durante el verano, se acerca en grandes grupos al Cant·brico donde se captura en la llamada ""costera del bonito"". Se caracteriza por su carne blanca, un sabor exquisito y una textura m·s suave que la del resto de su especie.

El cuerpo del Bonito del Norte es estilizado y est· protegido por escamas. El dorso presenta un caracterÌstico color azul oscuro, con el vientre gris·ceo y brillante. Se distingue por sus largas aletas pectorales. Su talla media es de 75 cm., alcanzando un peso de 10 a 15 Kg.

De los Bonitos del Norte que seleccionamos en Conservas Serrats, aprovechamos los Lomos, el Cogote y la Ventresca.";;bonito norte;bonito norte;bonito norte;;En Stock;No existencias;1;23/09/2013;21/09/2013;1;http://localhost/prestashop_1.5.6.0/img/p/1/5/15.jpg;0;;1;new;0;0;0;0;0;1;1;001
SER0002;1;Bonito del Norte en aceite de Oliva. Frasco cristal de 250g.;012005;3,555;2;;;;;;;;0016;Conservas Serrats;Conservas Serrats;;;;;;;250g;1;;both;;UN;;Lomos de Bonito del Norte, cuidadosamente seleccionados por Conservas Serrats, cubiertos con aceite de oliva y presentados en frasco de cristal;"TambiÈn denominado At˙n Blanco. Es el pescado de mayor calidad de la familia de los atunes y, durante el verano, se acerca en grandes grupos al Cant·brico donde se captura en la llamada ""costera del bonito"". Se caracteriza por su carne blanca, un sabor exquisito y una textura m·s suave que la del resto de su especie.

El cuerpo del Bonito del Norte es estilizado y est· protegido por escamas. El dorso presenta un caracterÌstico color azul oscuro, con el vientre gris·ceo y brillante. Se distingue por sus largas aletas pectorales. Su talla media es de 75 cm., alcanzando un peso de 10 a 15 Kg.

De los Bonitos del Norte que seleccionamos en Conservas Serrats, aprovechamos los Lomos, el Cogote y la Ventresca.

Para la elaboraciÛn de nuestro frasco de bonito, el ""RO 250"", utilizamos los lomos del Bonito. Una vez que est·n perfectamente limpios, uno a uno, se van introduciendo en el tarro de cristal de forma completamente manual. A continuaciÛn aÒadimos nuestro Aceite de Oliva especialmente seleccionado. Este aceite, con su sabor intenso, aÒade al Bonito un aroma y sabor exclusivo, un delicioso contraste entre el sabor del mar y el de la tierra seca por el sol.";;bonito norte;bonito norte;bonito norte;;En Stock;No existencias;1;23/09/2013;21/09/2013;1;http://localhost/prestashop_1.5.6.0/img/p/2/3/23.jpg;0;;1;new;0;0;0;0;0;1;1;001
SER0003;1;Bonito del Norte en Escabeche. Lata (estuche) de 120g. ;012005;1,755;2;;;;;;;;0016;Conservas Serrats;Conservas Serrats;;;;;;;120g;1;;both;;UN;;Lomos de Bonito del Norte, cuidadosamente seleccionados por Conservas Serrats, cubiertos con aceite de oliva y presentados en frasco de cristal;"TambiÈn denominado At˙n Blanco. Es el pescado de mayor calidad de la familia de los atunes y, durante el verano, se acerca en grandes grupos al Cant·brico donde se captura en la llamada ""costera del bonito"". Se caracteriza por su carne blanca, un sabor exquisito y una textura m·s suave que la del resto de su especie.

El cuerpo del Bonito del Norte es estilizado y est· protegido por escamas. El dorso presenta un caracterÌstico color azul oscuro, con el vientre gris·ceo y brillante. Se distingue por sus largas aletas pectorales. Su talla media es de 75 cm., alcanzando un peso de 10 a 15 Kg.

De los Bonitos del Norte que seleccionamos en Conservas Serrats, aprovechamos los Lomos, el Cogote y la Ventresca.

Para la elaboraciÛn de esta lata de bonito, el ""OL 120"", utilizamos los lomos del Bonito, a los que una vez fritos aÒadimos nuestro particular escabeche. Una antigua receta en la que, adem·s del vinagre como ingrediente fundamental, incorpora unos pequeÒos ""toques"" personales, que aÒaden al Bonito un aroma y sabor exclusivo.
";;bonito norte;bonito norte;bonito norte;;En Stock;No existencias;1;23/09/2013;21/09/2013;1;http://localhost/prestashop_1.5.6.0/img/p/1/1.jpg;0;;1;new;0;0;0;0;0;1;1;001
SER0004;1;Ventresca de bonito del norte en aceite de Oliva. Lata (estuche) de 120g.;012005;4,14;2;;;;;;;;0016;Conservas Serrats;Conservas Serrats;;;;;;;120g;1;;both;;UN;;Filetes de Ventresca de Bonito del Norte, cuidadosamente seleccionados por Conservas Serrats, cubiertos con aceite de oliva y presentados en envase met·lico;"La Ventresca es la zona situada en la parte inferior del pescado, la que est· cerca de la cabeza y es sin duda la parte m·s jugosa y sabrosa del Bonito. Un autÈntico lujo dentro de las conservas.


La lata de Ventresca ""OL 120"", contiene la parte de textura m·s suave y delicada del Bonito. Es la zona situada en la parte inferior del pescado, la que est· cerca de la cabeza, y es sin duda la parte m·s jugosa y sabrosa del Bonito. Un autÈntico lujo dentro de las conservas. A la ventresca, le aÒadimos nuestro aceite de oliva especialmente seleccionado. Este aceite, con su sabor intenso le aÒade un aroma y sabor exclusivos, convirtiÈndolo en un producto ˙nico.
";;venttresca bonito;venttresca bonito;venttresca bonito;;En Stock;No existencias;1;23/09/2013;21/09/2013;1;http://localhost/prestashop_1.5.6.0/img/p/6/6.jpg;0;;1;new;0;0;0;0;0;1;1;001
SER0005;1;Filetes de Anchoas del Cant·brico en aceite de oliva. Lata (estuche) de 50g. ;012002;2,655;2;;;;;;;;0016;Conservas Serrats;Conservas Serrats;;;;;;;50g;1;;both;;UN;;Filetes de Anchoas del Cant·brico, cuidadosamente seleccionadas por conservas Serrats, cubiertos con aceite de oliva y presentados en envase met·lico.;"FÌsicamente, es un pez pequeÒo que puede vivir alrededor de tres o cuatro aÒos y alcanzar una talla cercana a los 20 cm, de vientre plateado y dorso azul gris·ceo.

La anchoa es un pescado emigrante. El nombre latino es ""Engraulis"" y dependiendo de la zona de captura su segundo cambia y tambiÈn la calidad de su carne.

En Conservas Serrats, sÛlo utilizamos anchoa de la m·s alta calidad, la ""Engraulis Encrasicholus"", pescada en el Golfo de Vizcaya y en el mediterr·neo en su momento Ûptimo, entre los meses de Abril y Junio. Aunque viven a m·s de 100 metros de profundidad, en primavera y en verano suben a la superficie para reproducirse dando lugar a su pesca. Es en esa Època cuando su grasa aumenta, al igual que lo hace su sabor.

";;anchoas;anchoas;anchoas;;En Stock;No existencias;1;23/09/2013;21/09/2013;1;http://localhost/prestashop_1.5.6.0/img/p/7/7.jpg;0;;1;new;0;0;0;0;0;1;1;001
SER0006;1;Filetes de Anchoas del Cant·brico en aceite de oliva. Frasco cristal de 100g ;012002;5,22;2;;;;;;;;0016;Conservas Serrats;Conservas Serrats;;;;;;;100g;1;;both;;UN;;Filetes de Anchoas del Cant·brico, cuidadosamente seleccionadas por conservas Serrats, cubiertos con aceite de oliva y presentados en envase met·lico.;"FÌsicamente, es un pez pequeÒo que puede vivir alrededor de tres o cuatro aÒos y alcanzar una talla cercana a los 20 cm, de vientre plateado y dorso azul gris·ceo.

La anchoa es un pescado emigrante. El nombre latino es ""Engraulis"" y dependiendo de la zona de captura su segundo cambia y tambiÈn la calidad de su carne.

En Conservas Serrats, sÛlo utilizamos anchoa de la m·s alta calidad, la ""Engraulis Encrasicholus"", pescada en el Golfo de Vizcaya y en el mediterr·neo en su momento Ûptimo, entre los meses de Abril y Junio. Aunque viven a m·s de 100 metros de profundidad, en primavera y en verano suben a la superficie para reproducirse dando lugar a su pesca. Es en esa Època cuando su grasa aumenta, al igual que lo hace su sabor.


";;anchoas;anchoas;anchoas;;En Stock;No existencias;1;23/09/2013;21/09/2013;1;http://localhost/prestashop_1.5.6.0/img/p/1/3/13.jpg;0;;1;new;0;0;0;0;0;1;1;001
SER0007;1;Sardinillas pequeÒitas en aceite de oliva -unidades lata 16/20-. Lata (estuche) 120g.;012020;2,43;2;;;;;;;;0016;Conservas Serrats;Conservas Serrats;;;;;;;120g;1;;both;;UN;; Sardinillas en lata de 120 gramos y cubiertas de aceite de oliva especialmente seleccionado;"Conservas Serrats presenta sus sardinillas en lata de 120 gramos y cubiertas de aceite de oliva especialmente seleccionado. Aproximadamente en una lata podemos encontrar entre 16 a 20 piezas.

El punto de partida para su elaboraciÛn consiste en la selecciÛn de las mejores materias primas. Conservas Serrats adquiere las sardinillas frescas, piezas pequeÒas y de gran calidad. Cortadas, descabezadas y limpiadas a mano, las sardinillas se tuestan al vapor y se envasan en aceite de oliva. El tiempo transcurrido entre la captura y la conserva es mÌnimo, de este modo se garantiza un producto que mantiene intacta toda su riqueza y propiedades.

Con su olor y sabor caracterÌstico e intenso, las sardinillas de Serrats destacan por su atractivo aspecto plateado y su magnÌfica presentaciÛn: perfectamente limpias, brillantes y sabrosas, con una textura suave y jugosa.

En los ˙ltimos aÒos han adquirido gran fama por ser un alimento de alto valor nutritivo. Una lata de sardinillas en aceite de oliva, contiene una alta concentraciÛn de vitamina B12 adem·s de otras como las vitaminas A, D, K y E. Fuente importante de proteÌnas y tambiÈn de sodio, fÛsforo, yodo y calcio. Rica en ·cidos grasos poliinsaturados (especialmente los omega 3) y de ·cido oleico.";;sardinillas;sardinillas;sardinillas;;En Stock;No existencias;1;23/09/2013;21/09/2013;1;http://localhost/prestashop_1.5.6.0/img/p/1/4/14.jpg;0;;1;new;0;0;0;0;0;1;1;001
